,course_title,subject,num_lectures,num_reviews,content_duration,price
2502,Design Beautiful & Professional Ebooks Using FREE Software,Graphic Design,26,7,4.0,20
2503,Smashing Photoshop CC/CS,Graphic Design,76,7,5.0,20
2504,Create Mobile App Design from Scratch in Photoshop,Graphic Design,24,7,2.5,125
2505,Create Kindle eBook Covers with PowerPoint,Graphic Design,23,7,2.0,30
2506,How To Build Your Own Web Banner Design Business,Graphic Design,21,7,1.0,20
2507,Motion Graphic With After Effect From Scratch in 5 Hours,Graphic Design,45,7,4.0,30
2508,Drawing With Confidence,Graphic Design,10,7,2.0,25
2509,How to design professional PowerPoint business presentation,Graphic Design,7,7,1.0,20
2510,Instant Harmonica - play the groovy Beatles Yesterday today!,Musical Instruments,14,7,1.0,40
2511,How to Play Piano - Your First Lesson!,Musical Instruments,13,7,0.5166666666666666,0
2512,Playing Piano:  Play Chords and Popular Pieces Vol.I,Musical Instruments,43,7,3.0,100
2513,Learn to Play Harp: Beginners Course,Musical Instruments,10,7,0.6833333333333333,0
2514,Take your double bass drum technique to the next level,Musical Instruments,196,7,5.5,40
2515,Instant Harmonica - play Amazing Grace + Ode to Joy now!,Musical Instruments,23,7,1.5,40
2516,Advanced Euphonium Studies - Learn to Master the Euphonium!​,Musical Instruments,89,7,6.0,50
2517,Digital Pianist Course-Learn Piano & Keyboard Fast & Easy,Musical Instruments,35,7,3.0,150
2518,Mundharmonika spielen - mein schönstes Hobby,Musical Instruments,77,7,2.5,20
2519,Aprende el acordeón de oído y con técnica –Nivel Intermedio–,Musical Instruments,51,7,4.5,25
2520,Guitar Lessons - The Modal System - Modes Essentials,Musical Instruments,27,7,2.0,45
2521,Learn to Play Percussion: Beginner to Pro made the Easy Way!,Musical Instruments,192,7,6.0,50
2522,Master the Trombone: Intermediate Instruction Made Simple!,Musical Instruments,110,7,9.0,50
2523,Fingerpicking Fundamentals,Musical Instruments,22,7,1.5,20
2524,Alto Saxophone Lessons For Beginners,Musical Instruments,42,7,3.0,95
2525,Hands On Guitar: Beyond Beginner,Musical Instruments,69,7,3.0,20
2526,Blues Guitar Lessons - Blues Guitar - Robert Johnson,Musical Instruments,7,7,2.5,20
2527,Learn to Play Irish Fiddle,Musical Instruments,63,7,5.5,60
2528,Hands-On Guitar: The Beginner's Guide,Musical Instruments,72,7,4.0,20
2529,You Can Play Jazz Saxophone,Musical Instruments,6,7,1.5,20
2530,Aprende a tocar Guitarra RAPIDO y FACIL con Guitarsimple,Musical Instruments,16,7,4.0,40
2531,Pop and Jazz Keyboards and Harmony (beginner level),Musical Instruments,13,7,3.0,180
2532,Instant Harmonica - play Summertime in 8 fun & easy lessons,Musical Instruments,11,7,1.0,40
2533,Learn Building Your Own Website Without Coding,Web Development,19,7,2.0,50
2534,Twitter Integration customize Tweets with developer API,Web Development,19,7,1.0,115
2535,Wordpress Essentials: Useful Plugins,Web Development,24,7,1.0,25
2536,Joomla for Beginners - Learn how to build a website with CMS,Web Development,35,7,3.5,95
2537,Flexbox: The complete guide,Web Development,16,7,1.0,35
2538,ASP :basics for beginners,Web Development,8,7,1.0,35
2539,Learn W3.CSS,Web Development,10,7,0.5666666666666667,50
2540,Practical Web Development: Make Websites Quickly And Easily,Web Development,20,7,2.0,20
2541,"Learn to Code in HTML5, CSS3, and JavaScript",Web Development,17,7,2.5,20
2542,A Beginner's Guide to Quantopian Futures API,Business Finance,11,6,1.5,20
2543,B Com Accountancy I (Paper ECO 02 IGNOU),Business Finance,284,6,31.5,50
2544,Stock Market investment: Practical Accounting,Business Finance,43,6,3.0,125
2545,Bank Financial Management A Comprehensive Study,Business Finance,21,6,1.5,50
2546,Succeed in Bonds Even if You Don't Know Where to Start,Business Finance,8,6,1.0,200
2547,CFA Corporate Finance Level 2,Business Finance,128,6,17.5,50
2548,International Tax  - Tax Beyond boundaries,Business Finance,235,6,19.5,100
2549,Curso de Trading práctico basado en casos reales,Business Finance,55,6,10.0,20
2550,Finding an Unlimited Amount of Investors,Business Finance,6,6,0.7,80
2551,BITCOIN VISUALLY. Part I.,Business Finance,31,6,4.0,50
2552,Accounting for Deferred Taxes (Professional Course Level),Business Finance,11,6,1.5,25
2553,The Actuarial Profession: Basic Sciences and Principles,Business Finance,7,6,0.5833333333333334,25
2554,The Investment Banking Recruitment Series,Business Finance,26,6,3.5,40
2555,Breakout Patterns Workshop by Pattern Trader,Business Finance,15,6,1.5,60
2556,Financial Translation,Business Finance,29,6,1.5,20
2557,How To Crowdfund,Business Finance,17,6,1.5,30
2558,Professional Bookkeeping & Accounting 2 - Bank Daybook,Business Finance,36,6,2.0,35
2559,Accounting Standard 3 - An Analysis,Business Finance,11,6,1.0,25
2560,Bitcoin Trading 101,Business Finance,19,6,2.0,95
2561,Using Xero for your bookkeeping needs  do beautiful business,Business Finance,28,6,1.0,95
2562,"Internal Controls - Design, Implementation and Monitoring",Business Finance,27,6,6.5,195
2563,Stock Trading: Ultimate Guide to swing trading stocks,Business Finance,13,6,0.6833333333333333,200
2564,The Truths about (in)secure Retirement,Business Finance,32,6,4.5,200
2565,Options Trading Essentials: The ULTIMATE Guides,Business Finance,20,6,4.0,0
2566,1. Principles of Simple Interest ,Business Finance,13,6,1.0,20
2567,Technical Analysis: Understanding Price Action,Business Finance,37,6,3.0,45
2568,Basel II,Business Finance,57,6,3.5,50
2569,Learn Basic Concepts of Economics Step by Step - Complete,Business Finance,25,6,1.5,150
2570,Cost Accounting Overheads (Professional Course Level),Business Finance,19,6,2.5,20
2571,Forex - Price action Reversal Strategy,Business Finance,16,6,1.0,20
2572,"Fixed Income Valuation and Analysis, CFA L2",Business Finance,12,6,3.0,20
2573,Stock Markets: How I Became Rich By Changing How I Trade,Business Finance,17,6,1.0,20
2574,CFA Level 1 - Derivatives,Business Finance,25,6,4.0,30
2575,How to become a successful day trader,Business Finance,27,6,2.5,95
2576,Essentials of Finance and Investment in 2 hours,Business Finance,14,6,2.0,20
2577,Public Speaking: You Can Give Great Financial Presentations,Business Finance,23,6,6.5,20
2578,"Trade Stocks, Forex & Financial Markets like a Professional",Business Finance,12,6,3.0,20
2579,Advance Technical Analysis,Business Finance,14,6,3.5,50
2580,Legal Accounting,Business Finance,49,6,4.0,110
2581,Торговля дельта-нейтральными стренглами,Business Finance,25,6,1.5,150
2582,3 documentos clave para administrar tu empresa con éxito,Business Finance,18,6,1.0,45
2583,Inversión: Fundamentos del Trading para Principiantes,Business Finance,18,6,1.5,125
2584,Crowdfunding for Filmmakers,Business Finance,30,6,4.0,65
2585,Deinen Roman setzen mit PagePlus in 10 einfachen Schritten,Graphic Design,25,6,3.5,0
2586,How To Make Professional eBook Covers For FREE,Graphic Design,35,6,3.0,20
2587,Surface Pattern Design : Create Scandinavian Patterns,Graphic Design,8,6,0.7,40
2588,Create Awesome Ebook Covers Using Microsoft Word,Graphic Design,23,6,3.5,45
2589,Como Produzir Ebook e Livros com Adobe Indesign CC e CS6,Graphic Design,131,6,12.5,80
2590,Photoshop - Como criar Fusão de forma profissional,Graphic Design,34,6,4.0,30
2591,Advanced Features in Adobe Illustrator,Graphic Design,14,6,1.0,30
2592,Photo Manipulation: Master Photo Editing,Graphic Design,43,6,1.0,75
2593,App Design + Web Design + Photoshop = Combined Course,Graphic Design,24,6,2.0,115
2594,Adobe After Effect: Create 15 Advance Motion Graphic Element,Graphic Design,21,6,2.5,30
2595,Corel Draw X7 Eğitimi (Temelden İleri Seviyeye),Graphic Design,103,6,12.0,105
2596,Make your own great designs in PowerPoint: Quick & Easy,Graphic Design,10,6,1.0,20
2597,Affinity Designer for beginners,Graphic Design,23,6,4.5,20
2598,How to Create Top Ranking Mobile App Icons - iOS Edition,Graphic Design,13,6,1.0,35
2599,How To Create Amazing YouTube Custom Thumbnail Images,Graphic Design,16,6,1.5,25
2600,illustrator CC 2015.3 - Curso básico de ferramentas,Graphic Design,12,6,1.0,20
2601,The Complete Motion Graphic Course,Graphic Design,115,6,9.5,65
2602,Learn print production from start to finish,Graphic Design,16,6,1.0,35
2603,Pentatonic Scale Crash Course for Bass Guitar,Musical Instruments,24,6,1.0,0
2604,Playing Piano : Reading and Playing Classical Tunes Vol.I,Musical Instruments,34,6,2.0,50
2605,Learn Fun Dreamy Piano Techniques # 2 - Play Silver Bells,Musical Instruments,99,6,2.0,80
2606,Guitar Chord Riot! Learn to Play Guitar Like a Guitar Jedi,Musical Instruments,43,6,0.5,75
2607,Guitar Fretboard Mastery for the Blues Guitarist,Musical Instruments,5,6,1.0,20
2608,Instant Harmonica - play Amazing Grace with grace and ease!,Musical Instruments,14,6,1.0,40
2609,Play Piano 5: Improvise on Misty Eb Key Runs & 2-5 Chords,Musical Instruments,70,6,1.5,50
2610,ブルースギター入門,Musical Instruments,23,6,3.5,0
2611,Play Piano 8 - Play Over the Rainbow by Ear & Free Improvise,Musical Instruments,69,6,1.5,50
2612,Instant Harmonica - Learning the Basic 12 Bar Blues Bassline,Musical Instruments,10,6,1.0,40
2613,Awesome Lead Guitar 1,Musical Instruments,38,6,4.5,25
2614,Play Piano Today - Easy Festive Favorites & Piano Party Hits,Musical Instruments,80,6,4.0,75
2615,Trombone Pro Series - Fall in love with the Trombone,Musical Instruments,57,6,7.0,50
2616,Brass Master Class,Musical Instruments,30,6,2.0,20
2617,Modern Piano Lessons For Beginners,Musical Instruments,46,6,5.0,20
2618,Play Guitar and Understand Music Quick & Easy in 28 Days!,Musical Instruments,64,6,9.5,20
2619,Piano With A Pro,Musical Instruments,38,6,2.5,25
2620,"Master the Euphonium with Simple, Intermediate Instruction!",Musical Instruments,106,6,8.0,50
2621,Blues Accelerator - 21 Days to Blues Guitar Mastery,Musical Instruments,45,6,7.0,50
2622,"Trumpet Solos: Learn how to Perform Three Fun, Unique Pieces",Musical Instruments,53,6,2.5,50
2623,Master Oboe Playing: Intermediate Instruction Made Simple!,Musical Instruments,73,6,5.5,50
2624,Building Up To Barre Chords,Musical Instruments,12,6,0.7166666666666667,20
2625,Learn the Violin - Bowing Techniques,Musical Instruments,12,6,0.6666666666666666,80
2626,Tenor Banjo,Musical Instruments,18,6,1.0,40
2627,Aprende a tocar el acordeón de botones,Musical Instruments,24,6,2.0,50
2628,Guitar Lessons - Sweep Picking Arpeggio Essentials,Musical Instruments,13,6,1.5,35
2629,Funk Rhythm Guitar Techniques,Musical Instruments,7,6,1.5,35
2630,Violin lessons for beginners,Musical Instruments,15,6,1.0,20
2631,Bossa Nova - Guitar for Beginners,Musical Instruments,8,6,1.0,20
2632,Projects in Laravel: Learn Laravel Building 10 Projects,Web Development,70,6,10.5,50
2633,Complete RESPONSIVE Website Design with HTML5 & CSS3,Web Development,97,6,9.0,20
2634,Byte-Sized-Chunks: Dynamic Prototypes in Javascript,Web Development,24,6,3.0,20
2635,Superb jQuery Course - Become Certified jQuery Developer,Web Development,32,6,1.5,95
2636,XSLT :basics for beginners,Web Development,7,6,0.5333333333333333,35
2637,PHP Zend Framework 2:Creating a CRUD Application,Web Development,9,6,0.6333333333333333,40
2638,Build your own Beautiful Blog in WordPress + SEO,Web Development,28,6,3.0,200
2639,XML DOM - Crash Course for Beginners,Web Development,8,6,0.5666666666666667,45
2640,How to create Paypal and Credit card Payment Buttons,Web Development,8,6,1.0,65
2641,create a search engine for your website!,Web Development,12,6,1.5,20
2642,XPATH :basics for beginners,Web Development,8,6,0.6166666666666667,40
2643,How To Invest With Tiny Capital In Stocks ?,Business Finance,6,5,0.7,20
2644,Practical Financial Statement Analysis,Business Finance,45,5,4.5,75
2645,MQL4 Tutorial Golden Goose,Business Finance,12,5,1.5,20
2646,Business Accounting Made Easy,Business Finance,26,5,5.5,50
2647,Portfolio Management for CA / CS / CFA exams,Business Finance,8,5,1.0,20
2648,Mastering Countertrend Trading : High Profit Trading Pattern,Business Finance,11,5,1.0,40
2649,Financial Model Fundamentals-Learn the Essential Skills,Business Finance,27,5,2.5,75
2650,Simple Linear Regression Analysis ( A Complete Course ),Business Finance,29,5,1.5,200
2651,Filing with Companies House UK,Business Finance,9,5,1.0,30
2652,FastTrack to Stock Trading Strategies,Business Finance,12,5,3.5,25
2653,Easy Forex and Futures Trading,Business Finance,66,5,14.5,100
2654,Trade for Profit: Find-Trade Stocks Successfully Arabic عربي,Business Finance,65,5,2.5,95
2655,Chartered Financial Analyst (CFA) - Level 1 - FRA,Business Finance,17,5,14.5,30
2656,Financial and Business Simulation with Microsoft Excel,Business Finance,8,5,0.5166666666666666,20
2657,Professional Risk Manager (PRM) Certification: Level 3,Business Finance,22,5,12.5,50
2658,Learn How to File Taxes for Uber and Lyft Drivers,Business Finance,25,5,2.0,40
2659,Bank Reconciliation & VAT on Excel,Business Finance,19,5,1.5,20
2660,Commodity Futures Day Trading Strategies,Business Finance,28,5,5.0,95
2661,Learn to invest in the Stock Market,Business Finance,14,5,1.0,40
2662,How to Invest in Startups - Expert Reveals Winning Secrets.,Business Finance,145,5,8.5,0
2663,Basics of Economics For Beginners A to Z - A Complete Course,Business Finance,24,5,1.5,170
2664,Financial Management Capital Market Instruments,Business Finance,17,5,1.0,25
2665,NPV and IRR Techniques for CA / CFA / CPA Exams,Business Finance,55,5,7.5,20
2666,Working Capital Management for Entrepreneurs,Business Finance,15,5,1.0,20
2667,Learn Quickbooks to maintain books properly,Business Finance,26,5,2.5,20
2668,CFA Level I Foundation: Introduction to Financial Reporting,Business Finance,13,5,5.5,50
2669,Cómo Crear Políticas Contables bajo NIIF para PYMES,Business Finance,6,5,1.0,20
2670,Finanzas personales: Logrando la Libertad Financiera,Business Finance,12,5,2.0,30
2671,Le basi del Trading,Business Finance,18,5,3.5,200
2672,Professional Trading - Consistent Profits with Low Risk!,Business Finance,27,5,1.0,20
2673,Portfolio Management CFA L1 2016,Business Finance,34,5,5.0,20
2674,Raising Capital for Your Business,Business Finance,60,5,2.5,50
2675,Formação de preços em serviços,Business Finance,28,5,2.0,35
2676,Curso de Iniciación al Trading,Business Finance,40,5,10.5,85
2677,Forex/Opciones Binarias para Principiantes,Business Finance,9,5,2.0,25
2678,Торговля опционами: Как заработать на волатильности,Business Finance,29,5,2.0,150
2679,Excelを使ってビジネスシミュレーション：基礎編,Business Finance,47,5,5.0,85
2680,How to Trade Forex like a Hedge Fund: Long FX Strategies,Business Finance,32,5,1.5,115
2681,Basics of Tax in India  (College Level),Business Finance,28,5,2.0,20
2682,Revealed: Profitable Principles of Successful Traders ,Business Finance,26,5,3.0,25
2683,Introduction to Day Trading,Business Finance,36,5,1.0,50
2684,Learn How to Profit In Forex With Market Rhythms,Business Finance,17,5,1.5,20
2685,How To Create A Low Poly Portrait With The Pen Tool,Graphic Design,18,5,1.0,195
2686,Photo Editing in Photoshop - Beginner to Advanced in 1 Hour,Graphic Design,21,5,1.0,20
2687,Most Wanted Flat Design Techniques #2: Hipster Businessman,Graphic Design,25,5,1.5,95
2688,Conviértete en un experto de photoshop cc naked series,Graphic Design,122,5,12.0,30
2689,Adobe Photoshop Essentials: Master Adobe Photoshop CS6,Graphic Design,63,5,2.5,100
2690,Learn Photoshop for Design: 100% Practical Projects,Graphic Design,12,5,0.6666666666666666,20
2691,Photoshop - Tratamento de pele profissional,Graphic Design,16,5,1.5,100
2692,Adobe Illustrator: Learn Easy Logo Design.,Graphic Design,26,5,3.5,20
2693,How to Design Simple Promotional Materials in Photoshop,Graphic Design,23,5,2.5,55
2694,สร้างงานกราฟฟิคแอพพลิเคชั่นมือถือด้วย Adobe Illustrator,Graphic Design,30,5,9.5,20
2695,Create an Accelerated Learning Flowchart with Watercolors,Graphic Design,16,5,2.5,200
2696,Learn to Create Deliverable Brand Identity Package,Graphic Design,15,5,1.0,20
2697,Creating animation puzzles with Google Slides,Graphic Design,9,5,1.0,20
2698,A Beginners Guide to creating Vector Graphics With Photoshop,Graphic Design,19,5,2.0,20
2699,Photoshop: 5 Practical Techniques to Improve Your Skills,Graphic Design,5,5,0.7166666666666667,20
2700,How to Draw Majestic Animals: Dogs,Graphic Design,11,5,1.0,35
2701,Photoshop CC Eğitim Seti (YENİ),Graphic Design,202,5,16.0,100
2702,Essential Skills for Designers - Adobe Bridge,Graphic Design,13,5,1.0,20
2703,:::Beginners Guide To Creating Amazing Images with Canva:::,Graphic Design,17,5,1.0,25
2704,Photoshop　中級者、上級者がプロになるために最後に学ぶ「超絶技巧」テクニック,Graphic Design,39,5,4.5,85
2705,Plantillas Powerpoint para Publicar en Mercadolibre y Ebay,Graphic Design,32,5,2.0,35
2706,Photoshop: Organización de eventos y decoración de fiestas,Graphic Design,56,5,8.5,120
2707,Typographic Poster Design - From Sketch to Vector,Graphic Design,20,5,1.5,45
2708,Beginners Guide: Photoshop Poster/Artwork,Graphic Design,6,5,1.0,20
2709,Car Sketching with Simple Analog Tools,Graphic Design,10,5,0.6166666666666667,40
2710,Drawing Anime & Manga Style,Graphic Design,40,5,8.0,25
2711,Inkscape 101 for Beginners - Design Vector Graphics,Graphic Design,26,5,1.0,195
2712,Marvelous Logo Design,Graphic Design,13,5,1.5,20
2713,Mastering Realistic Real Life Drawing with Pencil,Graphic Design,12,5,0.65,20
2714,Adobe Photoshop CC | The Essential Guide,Graphic Design,81,5,4.5,20
2715,Piano Runs & Fills #3:  Jazzy Chromatic Chord Song Endings,Musical Instruments,28,5,1.0,70
2716,Teaching Music : Start teaching an instrument successfully.,Musical Instruments,18,5,1.5,30
2717,Instant Harmonica - play Dylan's Blowing in the Wind today!,Musical Instruments,14,5,1.0,20
2718,Play Thousands of Songs On The Guitar | Cheater Chords,Musical Instruments,12,5,1.0,100
2719,How to play in a local Irish music session with confidence,Musical Instruments,8,5,1.0,40
2720,Make Your Own Ukulele,Musical Instruments,23,5,4.5,85
2721,Play Piano 3: Improvise Chords to Enchanted Evening by Ear,Musical Instruments,57,5,1.5,50
2722,How to speak Pianish (beginner level),Musical Instruments,10,5,1.0,30
2723,Electric Guitar for Beginners - RockStarter Level 1,Musical Instruments,29,5,2.5,40
2724,Guitar Lessons - Blind Blake - King Of Ragtime Blues Guitar,Musical Instruments,13,5,4.0,20
2725,Instant Harmonica - play The Kesh (pt 1) it's easy and fun!,Musical Instruments,11,5,0.5833333333333334,40
2726,Instant Harmonica - play The Kesh (part 2) - easy and fun!,Musical Instruments,9,5,0.5833333333333334,20
2727,Curso de Guitarra para Principiantes,Musical Instruments,39,5,3.0,20
2728,Arpeggios for Guitar made Easy! Dominate the Fretboard,Musical Instruments,23,5,3.0,65
2729,Swing Low - The 101 Authentic Nashville Piano Style Course,Musical Instruments,15,5,1.0,20
2730,Get Piano Skills TODAY!!! ,Musical Instruments,71,5,3.5,100
2731,"Introduction to Guitar 'A Course for Beginners"",https://www.udemy.com/introduction-to-guitar/,true,25,163,11,56,Beginner Level,2.5 hours,2014-10-30T15:59:39Z
650804,Guitar  Master Class Learning How to Play Guitar from A to Z""",Musical Instruments,35,5,4.0,40
2732,Explosão Pentatônica,Musical Instruments,19,5,1.5,55
2733,Master the Tuba - Intermediate Instruction Made Simple!,Musical Instruments,107,5,8.5,50
2734,Oboe Pro Series - You're going to love practicing the Oboe,Musical Instruments,36,5,7.0,50
2735,Guitar Lessons - Economy Picking Essentials,Musical Instruments,15,5,1.5,35
2736,Piano Lessons for Beginners Made Easy,Musical Instruments,40,5,3.0,25
2737,Didgeridoo - from zero to HERO! Part Three. Advanced level.,Musical Instruments,19,5,1.5,35
2738,Blues Guitar Lessons - Volume 3 - Minor Blues Essentials,Musical Instruments,14,5,2.0,45
2739,Pure Rock Guitar : Play Like the Gods of Rock!,Musical Instruments,24,5,4.5,45
2740,Advanced Saxophone Studies - Learn to Master the Saxophone!,Musical Instruments,80,5,4.0,50
2741,Tenor Saxophone Lessons For Beginners,Musical Instruments,43,5,3.0,95
2742,Instant Harmonica - play Yesterday + Scarborough Fair today!,Musical Instruments,26,5,2.0,40
2743,"Mastering 'Native CSS Shapes To Build Modern Web Pages""",Web Development,30,5,3.5,195
2744,"ASP.NET Core MVC, Quick and Practical",Web Development,30,5,2.5,20
2745,Ajax  for Beginners: A Very Basic Introduction,Web Development,18,5,2.0,65
2746,Learn How to Create Your Own Social Network,Web Development,14,5,2.0,50
2747,Ultimate Css & JQuery Form Designing From Beginner to Expert,Web Development,13,5,1.0,115
2748,Learning Path: React: Make Stunning React Websites,Web Development,53,5,6.5,200
2749,How to Build an Autocomplete System Like Google,Web Development,9,5,1.0,30
2750,PHP Zend Framework 1.11:Creating a CRUD Application,Web Development,7,5,0.5833333333333334,40
2751,Learning Path: The Road to Elasticsearch,Web Development,60,5,5.0,200
2752,"Forex Trading with Fixed 'Risk through Options Trading""",Business Finance,26,4,1.0,200
2753,Top 10 Trading Ideas in the Equities Market,Business Finance,12,4,1.0,20
2754,Introduction to Futures Trading and Live Trade Demonstration,Business Finance,6,4,0.7166666666666667,60
2755,Trade Recap I - A Real Look at Futures Options Markets,Business Finance,11,4,1.5,20
2756,Stock Market investment:Non financial fundamental analysis,Business Finance,29,4,3.0,125
2757,Trading con retrocesos de Fibonacci,Business Finance,15,4,2.5,25
2758,Risk Analysis - Capital Budgeting for CA / CS / CFA exams,Business Finance,47,4,5.5,20
2759,MBA Accounting and Finance for Managers(Paper MS04 of IGNOU),Business Finance,272,4,26.0,150
2760,Cost Accounting Marginal Costing Theory and Practice,Business Finance,31,4,2.5,20
2761,Forex Rate -Why it fluctuates -for CA / CMA / CS / CFA Exams,Business Finance,7,4,1.0,20
2762,Basics of Commerce A Complete Study,Business Finance,105,4,5.5,150
2763,Get Credit for Your EIN That's Not Linked to Your SSN,Business Finance,15,4,1.5,20
2764,Introduction to Trade Theory (Technical Analysis) For Stocks,Business Finance,6,4,1.0,20
2765,Forex: Learn to Trade Forex and FX Consistently,Business Finance,21,4,5.5,50
2766,Fundraising 101,Business Finance,5,4,1.0,95
2767,Forex Trading System: Correlation EUR/GBP vs GBP/USD,Business Finance,26,4,1.0,50
2768,An Abundance Mindset: How to Craft Yours,Business Finance,40,4,4.5,50
2769,Accounting Bank Reconciliation Statement (College Level),Business Finance,16,4,1.5,20
2770,Intro to Impact Investing,Business Finance,12,4,0.5333333333333333,200
2771,Complete Guide to Business Loans,Business Finance,35,4,1.5,30
2772,1 - Concepts of Statistics For Beginners Step by Step,Business Finance,15,4,0.5166666666666666,200
2773,Trading mit kleinen Konten - Grundlagen die du kennen musst,Business Finance,20,4,3.5,80
2774,Wie funktionieren Bitcoin? Ein Einführungskurs.,Business Finance,14,4,0.6166666666666667,20
2775,MCA Accountancy and Financial Management -Paper MCS 35 IGNOU,Business Finance,460,4,43.5,180
2776,CFA Level I Workshop 1: Ethics and Quantitative Methods,Business Finance,5,4,1.0,20
2777,CFA Level I Foundation Course: Introduction to Quants,Business Finance,11,4,5.0,50
2778,Forex trading made simple,Business Finance,31,4,1.5,100
2779,10.  Bonds and Bond Pricing,Business Finance,10,4,1.0,20
2780,Forex - Top Equity Management Strategy,Business Finance,13,4,0.5833333333333334,20
2781,Learn the Basics of the Wave Principle:,Business Finance,10,4,1.5,30
2782,Trading: Basics of Trading for Beginners,Business Finance,20,4,1.5,140
2783,Learn Financial Modeling from Scratch - Part1,Business Finance,29,4,3.5,50
2784,"Financial Accounting, its Cycle, Statements & Analysis",Business Finance,35,4,5.0,20
2785,Learn the Forex Naked Price Action Pogo Trade,Business Finance,10,4,1.0,60
2786,Budget preparation for an EU project proposal,Business Finance,5,4,1.0,50
2787,high swing - كورس لتعليم جميع مراحل احتراف تداول الفوركس,Business Finance,17,4,2.5,100
2788,Aprende desde cero a operar el mercado de divisas FOREX,Business Finance,24,4,4.0,90
2789,Aprenda  a Investir,Business Finance,9,4,8.0,20
2790,Numeracy skills in business and everyday life:Think and Deal,Business Finance,15,4,0.6333333333333333,20
2791,"Technical Analysis Primer for trading Stocks, Bonds & Forex",Business Finance,36,4,3.0,50
2792,Beginner Financial Analysis: Invest Like Warren Buffett,Business Finance,19,4,0.6833333333333333,50
2793,QuickBooks Online : Inventory Management For Non-Finance,Business Finance,10,4,0.6666666666666666,35
2794,Financial Accounting Part 2 - Passing The Class,Business Finance,36,4,4.5,20
2795,The Cost of Capital: The Key To Attract Venture Capitalists,Business Finance,6,4,0.6833333333333333,50
2796,Easy Finance For Startups,Business Finance,6,4,0.6666666666666666,50
2797,Investimento em Ações,Business Finance,27,4,4.5,20
2798,Monetizing Your Website: How to Add Cost-Per-Action (CPA) ,Business Finance,18,4,1.0,35
2799,Learn Business Finance: Win more work as a Business Coach ,Business Finance,22,4,2.0,20
2800,Life Coach Business Basics: Finance and Operations,Business Finance,54,4,3.5,195
2801,Learn Advanced Photoshop Selections,Graphic Design,10,4,1.5,25
2802,Learn Cinema 4D: Create an Abstract Background,Graphic Design,9,4,0.5666666666666667,20
2803,Intro to Illustrator,Graphic Design,59,4,7.0,20
2804,Photoshop - Composição vintage,Graphic Design,9,4,1.0,30
2805,Mastering Photoshop Elements 15 Made Easy Training Tutorial,Graphic Design,185,4,6.5,30
2806,Manipulate Photos with GIMP,Graphic Design,11,4,2.0,20
2807,How to Make a Custom Graphic From Sketches ,Graphic Design,17,4,0.7333333333333333,20
2808,How to Draw Majestic Animals: Cats,Graphic Design,11,4,1.0,35
2809,Canva - Making Design Simple,Graphic Design,15,4,0.5333333333333333,20
2810,iPhone icons in iOS7 - learn flat design,Graphic Design,41,4,3.0,20
