,course_title,subject,num_lectures,num_reviews,content_duration,price
944,Trade Forex 13 Patterns - Golden Ratios Secret Revealed,Business Finance,44,63,4.0,200
945,Drawing in Perspective,Graphic Design,28,63,3.0,25
946,jQuery Fundamentals Powerful Bootcamp for beginners,Web Development,47,63,3.0,150
947,JavaScript for Beginners Welcome to learning JavaScript,Web Development,26,63,2.0,50
948,Mastering CSS 3.0 Selectors,Web Development,13,63,2.0,0
949,Java Spring Security,Web Development,11,63,2.5,40
950,Lerning PHP by building website,Web Development,34,63,8.0,185
951,Banking Credit Analysis Process (for Bankers),Business Finance,241,62,17.5,180
952,✔️ Illustrator CC : Be a Graphic Designer in Illustrator CC,Graphic Design,77,62,6.5,25
953,"Modern Web Development with SASS, Gulp, NPM & Web Workflows",Web Development,59,62,5.0,95
954,Learn jQuery AJAX in 1 hour,Web Development,18,62,1.0,195
955,Learn PHP Programming for Absolute Beginners - Lite,Web Development,7,62,0.6833333333333333,20
956,HTML5 APIs For JavaScript - A Course For Web Developers ,Web Development,45,62,5.0,50
957,Web Development: Make A Website That Will Sell For Thousands,Web Development,51,62,7.5,50
958,The Extreme Web Development Course - For Beginners,Web Development,152,62,5.5,200
959,Get Started With Penny Stocks -Step by Step Guide to Trading,Business Finance,18,61,2.0,200
960,Technical Analysis 101: Master the Basics of Trading,Business Finance,50,61,2.0,95
961,A Complete Guide to Successful Freelance Logo Design Career,Graphic Design,67,61,8.5,145
962,Learn UI/UX and Mobile App Design in Photoshop from Scratch,Graphic Design,31,61,3.0,145
963,Become A Web Developer And Seller - Build Websites With HTML,Web Development,35,61,2.5,200
964,Angular 2 Fundamentals for Web Developers,Web Development,41,61,6.0,40
965,A Complete Laravel basics from beginner to expert,Web Development,12,61,1.5,25
966,The Complete Web Developer Course - Build 20 Websites,Web Development,304,61,15.5,20
967,IAS 12 - Accounting for Income Taxes (Basics),Business Finance,17,60,4.5,0
968,Forex Breakout Profits: The Definitive Guide,Business Finance,27,60,2.5,25
969,Build a Trading Comps Valuation Model,Business Finance,55,60,7.0,50
970,Contabilidad rápida y eficaz,Business Finance,60,60,2.0,40
971,How to create HTML Forms,Web Development,7,60,0.6666666666666666,30
972,Learn Express,Web Development,14,60,1.5,25
973,Learn HTML5 At Your Own Pace. Ideal for Beginners,Web Development,67,60,7.0,50
974,The Ultimate Guide to Dividend & Dividend Growth Investing,Business Finance,88,59,5.5,200
975,Tax Strategy: Financial Planning for Beginners,Business Finance,25,59,2.0,200
976,Build a Single Page Application with jQuery & AJAX,Web Development,27,59,2.0,60
977,Django + AngularJS for a Powerful Web Application,Web Development,36,59,5.5,95
978,"Basic Concepts of Web Development, HTTP and Java Servlets",Web Development,10,59,1.0,35
979,RESTful Services with ASP.NET Web API,Web Development,34,59,2.0,85
980,Master EmberJS : Learn Ember JS From Scratch,Web Development,103,59,6.5,120
981,JavaScript Introduction to Object Oriented JavaScript,Web Development,23,59,1.5,90
982,Building Responsive Data Visualizations with D3 JS,Web Development,28,59,2.0,85
983,HTML5 for beginners,Web Development,59,59,5.0,195
984,Bitcoin - Ethereum: Trading -Watch me manage my own account!,Business Finance,22,58,2.5,165
985,How To Start Trading Penny Stocks In 10 Easy Steps 2017,Business Finance,15,58,1.5,50
986,How to stylize your photos in Photoshop with color overlays,Graphic Design,17,58,1.5,0
987,World's Fastest Piano Method - The Piano Revolution!,Musical Instruments,31,58,2.0,95
988,The Complete Wordpress Plugin Development Course - 8 Plugins,Web Development,33,58,2.5,200
989,JavaScript in Action JavaScript Projects,Web Development,17,58,1.5,150
990,Sending email with PHP: from Basic to Advanced,Web Development,45,58,2.0,40
991,XML For Absolute Beginners: Learn to create your own tags,Web Development,10,58,1.0,75
992,The Complete E-Commerce Web Developer Course 5.0,Web Development,96,58,12.5,195
993,FOREX Trading with Price Action,Business Finance,19,57,1.0,195
994,The Basics Of Volume Analysis,Business Finance,13,57,1.5,60
995,All-in-One Premium Design Course - Scratch to Pro+ Edition,Graphic Design,56,57,5.5,200
996,Logo Design Theory & Application Bootcamp,Graphic Design,35,57,7.0,50
997,Adobe Illustrator: Create a Quick & Easy Unique Illustration,Graphic Design,19,57,1.5,95
998,Book Covers and Graphic Design with PowerPoint 2013/2016/365,Graphic Design,30,57,4.0,195
999,Adobe Illustrator Course in Urdu Basics Level Training,Graphic Design,8,57,1.0,0
1000,Ultimate Blues Guitar Beginner Lessons,Musical Instruments,90,57,10.5,20
1001,AngularJS For ASP.NET MVC Developers,Web Development,10,57,1.0,50
1002,Javascript for beginners,Web Development,14,57,1.5,75
1003,Become a Bootstrap Expert: Build 20 Layouts!,Web Development,179,57,17.5,35
1004,Advanced HTML5 Tutorial for Web Developers,Web Development,57,57,7.5,50
1005,Adventure Capital: How to pay off debt ,Business Finance,14,56,1.0,20
1006,Complete Claritas Investment Certificate,Business Finance,35,56,11.5,50
1007,Weekly Options and study of Options expiration dynamics,Business Finance,6,56,1.0,60
1008,The Complete PHP Bootcamp Course With Video Sharing Project,Web Development,74,56,14.5,195
1009,Master ExpressJS to Build Web Apps with NodeJS&JavaScript,Web Development,24,56,3.5,50
1010,Learn Jquery from Scratch 2-Hour Training ,Web Development,13,56,1.5,20
1011,Create an Engaging Website with Twitter Bootstrap 2.x,Web Development,24,56,1.0,20
1012,Advanced Scalable Python Web Development Using Flask,Web Development,71,56,14.0,120
1013,JavaScript for beginners in 1 hour,Web Development,22,56,1.0,95
1014,How to Install WordPress From Scratch,Web Development,13,56,1.0,0
1015,"Using 'The Greeks To Understand Options""",Business Finance,5,55,1.0,50
1016,CREDIT SPREAD SURGERY - Bear Call and Bull Put Mastery ,Business Finance,16,55,2.0,60
1017,ビットコイン生態系｜既存通貨が主役をやめる日,Business Finance,16,55,1.5,20
1018,Navigate the 10-K and Other Financial Reports,Business Finance,20,55,2.5,40
1019,Character Concept Design for Beginners,Graphic Design,98,55,16.5,175
1020,Acoustic Fingerstyle Guitar Course: Beginner to Advanced,Musical Instruments,56,55,4.0,200
1021,Ruby on Rails 4---A Test-Driven Approach,Web Development,122,55,19.0,100
1022,Beginners Introduction to Web Development,Web Development,18,55,1.5,200
1023,React: Learn ReactJS Fundamentals for Front-End Developers,Web Development,26,55,4.0,55
1024,Excel functions to analyze and visualize data,Business Finance,16,54,2.0,20
1025,Fundamentals of Investing!,Business Finance,13,54,2.0,20
1026,TechniTrader Leading Hybrid Indicator Trading,Business Finance,5,54,1.0,20
1027,Excel Dashboard - Interactive Excel Dashboard and Charts,Business Finance,34,54,3.0,30
1028,Forex - Elliott Wave Theory with Fibonacci. ,Business Finance,32,54,1.5,20
1029,Financial Statements Analysis: Learn to Invest Like a Pro!,Business Finance,35,54,2.5,50
1030,Straddles and Strangles - Volatility moves in any direction,Business Finance,11,54,1.5,60
1031,Fixed Income Securities,Business Finance,24,54,4.5,50
1032,Adobe Illustrator For Beginners: Design A Typographic Logo,Graphic Design,27,54,1.5,30
1033,3 step formula for playing guitar by ear,Musical Instruments,20,54,1.5,25
1034,Get Results - Core Principles of Web Development Tricks Tips,Web Development,26,54,1.5,75
1035,Devtools 2017: Beginner to Expert w/ Chrome Developer Tools,Web Development,39,54,2.5,125
1036,Learning Docker and Kubernetes by Lab,Web Development,56,54,5.0,30
1037,Learn Bootstrap 4 by Example,Web Development,9,54,1.0,0
1038,Learning Object-Oriented JavaScript,Web Development,23,54,3.0,75
1039,Complete PHP Course with OOP Start to Finish!,Web Development,29,54,2.0,200
1040,"Learn animation using CSS3, Javascript and HTML5",Web Development,18,54,2.5,40
1041,How to Create Your Personal Budget,Business Finance,10,53,1.0,20
1042,"IAS37 - Provisions, Contingents Liabilities & Assets",Business Finance,29,53,4.0,0
1043,Learn GIMP,Graphic Design,34,53,6.5,20
1044,Learn Photoshop Quickly (For Bloggers & Web Images),Graphic Design,28,53,2.5,80
1045,Learn How To Design a Logo in Adobe Illustrator in 30 Mins,Graphic Design,14,53,0.5,50
1046,"Master JavaScript Programming, 3 Projects Included !!",Web Development,107,53,10.5,20
1047,CSS Web Development Crash Course,Web Development,26,53,2.5,20
1048,PHP Date and Time Course by Edwin Diaz,Web Development,14,53,1.5,40
1049,Build Websites from Scratch with Squarespace,Web Development,60,53,3.5,50
1050,Projects in Django and Python,Web Development,28,53,6.5,60
1051,Kids Coding - Beginner HTML,Web Development,19,53,1.0,20
1052,Spring 4 Mastercourse: Covers Annotation & XML Configuration,Web Development,320,53,23.5,200
1053,Single Page Application of MVC 5 Using AngularJS,Web Development,18,53,1.5,20
1054,CSS Image filters - The modern web images color manipulation,Web Development,16,53,1.5,0
1055,Forex Trading Course: Work Smarter Not Harder Proven Results,Business Finance,16,52,2.0,195
1056,Technical Analysis - A practical approach for trade entry,Business Finance,15,52,2.0,60
1057,Finance - Ratios Analysis & Interpretations,Business Finance,41,52,2.5,30
1058,Binary Options Beginners Guide : Nadex,Business Finance,39,52,2.0,40
1059,Inkscape For Beginners 2016/2017,Graphic Design,26,52,4.0,40
1060,Mastering Photoshop: From Beginner to Industry Professional,Graphic Design,79,52,12.5,25
1061,Learn To Play The Drums Without A Drum Kit,Musical Instruments,39,52,2.0,25
1062,Keyboard Instruments - Read Sheet Music for Piano Fast!,Musical Instruments,41,52,1.5,50
1063,CAGED Pentatonic System for Guitar - Level 1,Musical Instruments,35,52,1.5,45
1064,Node.js: The Essentials + API Frameworks Express KOA Sails,Web Development,34,52,1.0,20
1065,Become a Heroku Rails Ninja: Expert Level Deployment Tools,Web Development,30,52,8.5,50
1066,"Learn HTML, A practical guide from scratch to HTML 5",Web Development,31,52,3.0,100
1067,Learn how to convert PSD to HTML and CSS responsive,Web Development,14,52,2.5,30
1068,Learn HTML Basics From Scratch,Web Development,21,52,3.0,0
1069,Learn PHP CodeIgniter Framework with AJAX and Bootstrap,Web Development,21,52,2.5,75
1070,Code & Grow Rich:  Earn More As An Entrepreneur Or Developer,Web Development,491,52,57.0,200
1071,Getting Started with HTML,Web Development,17,52,1.5,40
1072,HTML and CSS for Absolute Beginners,Web Development,26,52,3.0,0
1073,JavaScript Basics for Beginners Introduction to coding,Web Development,18,52,1.5,150
1074,JavaScript Promises: Applications in ES6 and AngularJS,Web Development,20,52,2.5,75
1075,WE WILL PAY YOU TO TRADE WITH US,Business Finance,11,51,2.0,20
1076,How to Build a Massive Stock Portfolio from Zero!,Business Finance,129,51,11.0,200
1077,Finance for Non-Finance: Learn Quick and Easy,Business Finance,30,51,2.5,20
1078,Finanzielle Unabhängigkeit-1: Erste Schritte zur Million,Business Finance,28,51,1.0,20
1079,Graphic Design for Entrepreneurs...Who Can't Draw,Graphic Design,13,51,1.5,20
1080,The Essentials of Acoustic Guitar Strumming Patterns,Musical Instruments,19,51,1.0,0
1081,JavaScript Rockstar How to create Incredible Useful code,Web Development,27,51,2.5,75
1082,Java Web Services Part 2,Web Development,74,51,3.0,20
1083,Mental Models For Wall Street - Become A Better Trader,Business Finance,35,50,2.0,0
1084,Learn Wave accounting to maintain books properly,Business Finance,27,50,3.0,0
1085,Illustrator CC MasterClass,Graphic Design,86,50,12.0,95
1086,Drawing Perspective For Beginners,Graphic Design,44,50,7.5,150
1087,Become A Logo Designer ,Graphic Design,39,50,2.5,95
1088,Create a Dynamic User Registration Form from scratch,Web Development,38,50,3.0,100
1089,HTML Made Simple For Beginners: Create a One Page Website,Web Development,16,50,2.0,65
1090,You can create Incredible Websites with HTML CSS learn how,Web Development,28,50,2.5,100
1091,"Web Scraping with Python, Ruby & import. io",Web Development,46,50,4.5,75
1092,Learn Spring Framework Practically - Hands On Recipies,Web Development,48,50,5.5,145
1093,Build a Complete Registration and Login System using PHP MVC,Web Development,106,50,5.0,80
1094,How to easily Manage your WordPress Website,Web Development,21,50,2.0,20
1095,The Complete Guide to Professional Trading with Elliott Wave,Business Finance,43,49,4.5,115
1096,"Professional Options Trading, Simplified",Business Finance,21,49,2.0,200
1097,Trading Trends in ANY Market,Business Finance,22,49,2.0,30
1098,Robots de Forex: espere ganar 175%p.a! Incluye Robot de Fx! ,Business Finance,41,49,5.0,130
1099,自分に合った投資信託を見つけよう！,Business Finance,23,49,2.0,25
1100,Learning Photoshop CC 2015,Graphic Design,163,49,10.5,50
1101,Creative logo design with Inkscape for free,Graphic Design,25,49,4.0,40
1102,Ultimate Guide on Freelancing Career in Photoshop Design,Graphic Design,82,49,6.5,165
1103,Learn to Design a Logo in Adobe Illustrator,Graphic Design,29,49,4.5,20
1104,Adobe Photoshop CC - Fundamentos,Graphic Design,88,49,7.5,40
1105,Play Sonny Terry style on Harmonica and dazzle your friends!,Musical Instruments,51,49,5.5,200
1106,HTML CSS Learn to create a website from scratch,Web Development,32,49,2.0,50
1107,Hit the ground running with AngularJS with Dion Yang,Web Development,13,49,1.5,100
1108,"Build Your Own Calculator App with Javascript, HTML5 & CSS",Web Development,11,49,1.0,50
1109,Learn By Example: jQuery,Web Development,78,49,7.0,50
1110,jQuery for Absolute Beginners - Lite,Web Development,7,49,0.5833333333333334,20
1111,3D Programming with WebGL and Babylon.js for Beginners,Web Development,18,49,2.0,200
1112,"Forex Trading Secrets |MT4 Robot (EA) inside, no coding",Business Finance,29,48,0.6833333333333333,150
1113,Forex SOS Course: Trading Tweaks And Working Forex Strategy,Business Finance,59,48,2.5,50
1114,FOREX TRADING - Learn in a quick + profitable way + support,Business Finance,47,48,3.5,100
1115,Venture Capital. What is it and Why it Matters to You!,Business Finance,25,48,2.5,50
1116,Value Investing For Beginners,Business Finance,25,48,2.5,100
1117,Financial Modeling - Build Your Own 3 Statement Projection,Business Finance,13,48,1.0,20
1118,Commercial Credit Analysis,Business Finance,42,48,7.5,50
1119,Learn How To use Channels to find amazing Forex Entries,Business Finance,15,48,1.0,45
1120,Learn Blender 3D - The materials and texture course,Graphic Design,105,48,12.5,200
1121,WordPress for Beginners - Tutorial - From Novice to Know-How,Web Development,39,48,4.0,20
1122,Learn to Freelance with People Per hour  (URDU),Web Development,8,48,0.6,20
1123,Kali Linux Web App Testing,Web Development,29,48,3.0,75
1124,Building Web Applications with Spring MVC,Web Development,28,48,3.0,85
1125,Angularjs-WebApi2-EFCodeFirst Web App On 3-Tier Architecture,Web Development,46,48,6.5,60
1126,Creating Custom Web Maps,Web Development,29,48,2.0,50
1127,Introduction to Node.js Development,Web Development,16,48,1.0,55
1128,Learn Web Development by Creating a Social Network,Web Development,80,48,6.5,200
1129,Advanced Excel functions,Business Finance,15,47,1.5,20
1130,Capital Market Road Map,Business Finance,21,47,4.0,50
1131,Beginners Forex strategy,Business Finance,20,47,1.0,0
1132,Apprendre à trader sur le marché du Forex - guide complet,Business Finance,38,47,3.0,140
1133,Learn to Play Trombone: Go From Beginner to Pro in No Time!,Musical Instruments,123,47,7.5,50
1134,Guitar Kick Start,Musical Instruments,22,47,1.0,0
1135,"Learn to code, Become a Web Developer and Master JavaScript!",Web Development,91,47,10.0,200
1136,Inspirational Web Development - A Beginner Approach -,Web Development,28,47,3.5,20
1137,Hosting your static website on Amazon AWS S3 service,Web Development,16,47,1.5,20
1138,Learn Laravel: Create Your Web App Step-By-Step,Web Development,35,47,4.0,45
1139,Forex Trading MAKE YOUR FIRST TRADE TODAY!,Business Finance,45,46,4.0,150
1140,Option selling trading as income source. Beginners friendly,Business Finance,61,46,6.0,195
1141,Investimento em Ações para Leigos,Business Finance,19,46,2.5,20
1142,Kostenrechnung lernen leicht gemacht,Business Finance,72,46,3.0,40
1143,Financial Modeling and Valuation: Complete Beginner to Pro,Business Finance,28,46,5.0,50
1144,master course - realistisch zeichnen lernen,Graphic Design,33,46,5.0,20
1145,Sketchbook Pro for Beginners,Graphic Design,41,46,4.0,125
1146,Blues and Advanced Guitar Lessons,Musical Instruments,131,46,7.5,85
1147,How to Optimise Your WordPress Website's Speed & Security to Improve SEO & User Experience,Web Development,31,46,3.5,125
1148,HTML and CSS Crash Course for Beginners,Web Development,31,46,4.5,50
1149,PHP User Login Registration Script With All Features,Web Development,47,46,4.0,200
1150,JavaScript manipulation of the DOM Document Object Model,Web Development,20,46,1.5,20
1151,JavaScript for beginners with live examples,Web Development,49,46,4.0,195
1152,Python Web Programming,Web Development,60,46,6.0,100
1153,Mastering Meteor: Reactive Full Stack JavaScript,Web Development,37,46,3.0,95
1154,"AngularJS for Beginners, Single-Page Applications Made Easy",Web Development,30,46,1.5,200
1155,Webpack 1 & 2 - The Complete Guide,Web Development,79,46,6.5,40
1156,How To Maximize Your Profits Trading Options,Business Finance,26,45,2.0,200
1157,Forex Trading Like Banks – Step by Step with Live Examples,Business Finance,40,45,4.5,195
1158,Bookkeeping Basics:  Understand the Fundamentals,Business Finance,48,45,4.5,75
1159,Stock Market for Beginners - Complete Starter Toolkit,Business Finance,82,45,6.5,120
1160,Bitcoin Peer Investing: How To Generate Double Digit Returns,Business Finance,41,45,2.5,25
1161,Learn to Trade With Fibonacci Tools,Business Finance,30,45,4.0,30
1162,The Holy Grail of Auto Trading Forex Futures Stocks Revealed,Business Finance,7,45,1.0,50
1163,Create Your Own Automated Stock Trading Robot In EXCEL!,Business Finance,44,45,5.0,150
1164,Basel Norms (Basel 1/ Basel 2/ Basel 3) Simplified,Business Finance,34,45,4.0,40
1165,MetaTrader4 Platform Training,Business Finance,15,45,1.5,0
1166,Aprende a utilizar Canva,Graphic Design,11,45,0.6666666666666666,20
1167,Darbuka Drumming: Learn how to play the Darbuka Dounbek,Musical Instruments,11,45,1.0,0
1168,Learn To Create Different Website Layouts & Media Queries ,Web Development,22,45,2.0,195
1169,Web Development with BootStrap - 16 Instant Themes Included!,Web Development,27,45,3.5,40
1170,Learn Authentication With ASP.NET Identity Security 2017,Web Development,13,45,2.0,50
1171,Master Typescript : Learn Typescript from scratch,Web Development,60,45,3.5,95
1172,Ruby on Rails Foundations,Web Development,73,45,6.5,20
1173,Modern E-Commerce Store In php & mysqli With Bootstrap,Web Development,358,45,66.5,50
1174,Introduction to Options - Strategies For Consistent Profits,Business Finance,55,44,4.5,40
1175,Financial Accounting: The Complete Introductory Crash Course,Business Finance,69,44,10.0,100
1176,Financial modeling: Build a forward looking financial model,Business Finance,22,44,2.0,20
1177,Master Calendar Spreads with this live trade on Gold (GLD),Business Finance,6,44,1.0,60
1178,Finance for Non Finance Executives,Business Finance,187,44,13.0,180
1179,Adobe Illustrator T-Shirt Design for Merch by Amazon,Graphic Design,15,44,1.0,20
1180,"YOU can Draw, Shade and Paint a Mixed Media Girl...today!",Graphic Design,19,44,3.0,30
1181,Graphic Design: Create Animated GIF Ad Banners in Photoshop,Graphic Design,20,44,1.0,20
1182,How to Design a Logo in Adobe Illustrator,Graphic Design,24,44,1.0,100
1183,Blues School! A Course For Beginners in Blues Piano & Improv,Musical Instruments,54,44,3.0,120
1184,Get great playing HARMONICA - a fun new leisure time hobby !,Musical Instruments,17,44,2.0,35
1185,Discover HTML Essential guide to HTML how to create webpages,Web Development,22,44,1.5,85
1186,Better way towards CSS using Less and Sass,Web Development,26,44,1.5,20
1187,"The Complete JavaScript, HTML and CSS Tutorial For Beginners",Web Development,21,44,3.0,35
1188,Advanced WordPress Topics: Post Types Taxonomies & Metaboxes,Web Development,91,44,7.5,95
1189,Build a website HTML5 CSS3 Beginner Course,Web Development,28,44,2.0,150
1190,Build A Weather App With Ajax Using Open Weather Map API,Web Development,38,44,4.0,20
1191,Get started Creating Websites Everything you need provided,Web Development,43,44,3.0,100
1192,Become a Kick-Ass Web Developer: From Newbie to Pro,Web Development,353,44,48.5,200
1193,Fundamentals of Accounting,Business Finance,25,43,3.0,20
1194,Forex: What's a Trend and When it is Strong and Reliable,Business Finance,30,43,2.0,0
1195,Options Spreads Bundle-  the heart of Options Trading,Business Finance,8,43,2.5,120
1196,财务分析与估值建模入门,Business Finance,10,43,1.5,0
1197,Cost Accounting - A Comprehensive Study,Business Finance,286,43,29.5,180
1198,Corel Draw x7,Graphic Design,62,43,12.0,20
1199,How To Design A Fortune 500 Logo in Illustrator,Graphic Design,72,43,5.0,195
1200,Percussive Fingerstyle Guitar,Musical Instruments,74,43,1.5,50
1201,JavaScript DOM Dynamic Web interactive content Boot Camp,Web Development,59,43,2.5,75
1202,The Complete Web Development Tutorial Using React and Redux,Web Development,29,43,4.0,40
1203,WordPress local server setup and site migration online,Web Development,12,43,1.0,55
1204,jQuery Essentials: Learn the Fundamental of jQuery,Web Development,40,43,3.5,20
1205,How To Make an eCommerce Website With Wordpress 2017,Web Development,26,43,4.5,0
1206,Email Marketing: Send Unlimited Emails via Own Mail Server,Web Development,20,43,1.0,35
1207,Learn the Basics of Programming for Marketers,Web Development,26,43,3.5,55
1208,Fundamentals of Angular 2 Full Stack Design,Web Development,49,43,6.5,95
1209,Ultimate JavaScript Objects,Web Development,65,43,2.5,20
1210,Trading Options With Money Flow,Business Finance,17,42,1.0,200
1211,Cryptocurrency Trading: Complete Guide To Trading Altcoins,Business Finance,35,42,5.0,95
1212,Python Algo Trading: FX Trading with Oanda,Business Finance,33,42,3.0,200
1213,CryptoArbitrager: Bitcoin Trading Robot (no mining),Business Finance,14,42,0.55,150
1214,The Tax Advantaged Investor: A Guide to Legal Tax Reduction!,Business Finance,25,42,2.0,0
1215,Ferramentas Visuais,Graphic Design,18,42,5.0,0
1216,Canva: Design Album Cover Artwork in Minutes - No More Fees!,Graphic Design,11,42,0.6666666666666666,0
1217,The Play-Doh Technique: Fun Hand-made Vectors In Illustrator,Graphic Design,20,42,0.6333333333333333,20
1218,Pixelmator - Create Vector Graphics From Scratch,Graphic Design,36,42,3.0,20
1219,Curso de Violão Popular,Musical Instruments,27,42,6.0,25
1220,Learn React JS from scratch,Web Development,34,42,4.0,115
1221,Supercharging Development With Atom Text Editor,Web Development,28,42,1.5,20
1222,The Complete HTML5 and CSS3 Course - with 8 Websites Design,Web Development,78,42,7.5,30
1223,Build Responsive Websites  in an Hour using Portalfin,Web Development,17,42,0.7333333333333333,0
1224,Crash Course on Cost of Capital and Capital Structuring,Business Finance,19,41,3.0,0
1225,Algorithmic Trading in MATLAB: WFAToolbox App GUI (Finance),Business Finance,21,41,1.0,20
1226,Accounting Made Easy: A Quick Guide to Financial Accounting,Business Finance,18,41,1.5,95
1227,"Backspreads, Diagonals and Butterflies - Advanced Strategies",Business Finance,10,41,2.0,60
1228,Global Macro Investing - Take Control Of The World's Markets,Business Finance,27,41,2.0,30
1229,"Geld verdienen mit dem Ticken der Uhr, wie Warren Buffett!",Business Finance,33,41,5.0,195
1230,Make Flat Design Space Ships in 30 Minutes in Illustrator!,Graphic Design,5,41,0.55,50
1231,Blues Master - Beginner's Techniques Piano Course,Musical Instruments,16,41,1.5,0
1232,Fun Beginner Ukulele Course,Musical Instruments,17,41,1.5,55
1233,Start Writing JavaScript Today - Beginner JavaScript Course,Web Development,27,41,3.0,100
1234,Javascript ES6! A Complete Reference Guide to Javascript ES6,Web Development,48,41,7.0,175
1235,Mastering the Google Chrome Developer Tools,Web Development,31,41,0.6666666666666666,20
1236,Create a Powerful Website with the Cool Bootstrap Framework,Web Development,25,41,4.0,0
1237,Advance JavaScript for Coders: Learn OOP in JavaScript,Web Development,54,41,11.5,40
1238,HTML Forms For Beginners: A Basic Introduction  ,Web Development,8,41,1.0,45
1239,Trading for Beginners - Intermediate Level,Business Finance,39,40,5.0,150
1240,Financial analysis: Compare performance of companies,Business Finance,20,40,1.0,20
1241,Quantitative Trading Analysis with R,Business Finance,53,40,7.5,50
1242,Ultimate Stock Market Investing: Learn How to Value Stocks,Business Finance,46,40,3.5,50
1243,６時間でインターバンク市場を攻略！最短距離でトレード基礎力,Business Finance,54,40,4.0,35
1244,Forex Trading using professional indicators by TOP traders,Business Finance,28,40,3.5,200
1245,Introducción a las Finanzas,Business Finance,15,40,1.5,30
1246,The Intelligent Investor,Business Finance,44,40,10.5,30
1247,Typographic Logo Design in Illustrator - Beginners & Beyond,Graphic Design,27,40,1.5,150
1248,Mastering advance Photoshop,Graphic Design,21,40,2.0,20
1249,InDesign: Diseño de proyectos paso a paso,Graphic Design,77,40,4.5,150
1250,Graphic Design: Double Your Sales With Canva,Graphic Design,39,40,2.5,20
1251,الدورة الشاملة illustrator from zero to hero,Graphic Design,158,40,30.0,150
1252,Guitar - 12  Strumming Patterns You Must Know For Guitar,Musical Instruments,16,40,1.0,50
1253,Fingerstyle Guitar Mastery: 3 Techniques You Need To Know,Musical Instruments,13,40,0.5666666666666667,0
1254,Build a Website in 30 Minutes,Web Development,12,40,0.5333333333333333,95
1255,"Create Complete Sign up System using PHP, jQuery and Ajax",Web Development,25,40,3.0,200
