,course_title,subject,num_lectures,num_reviews,content_duration,price
1884,How to become an App Developer,Web Development,10,17,1.0,200
1885,Learn JavaScript From Scratch:Become Top Rated Web Developer,Web Development,87,17,5.0,65
1886,Create a social network using PHP Mysqli HTML Css and JQuery,Web Development,27,17,6.0,40
1887,WordPress Security - The Ultimate Security Guide,Web Development,29,17,1.5,60
1888,"Complete guide to install Wordpress, PHP on Cloud,AWS or VPS",Web Development,28,17,3.0,50
1889,Bootstrap 4 Responsive Web Design and Development,Web Development,73,17,7.5,20
1890,Learn basics of HTML in 30 Minutes,Web Development,11,17,0.55,20
1891,The Most Powerful Options Spread Trading Front Ratio Spread,Business Finance,18,16,2.0,200
1892,Advanced Accounting A Complete Study for CA / CMA / CFA / CS,Business Finance,462,16,62.0,150
1893,Basic Bookkeeping Hacks,Business Finance,28,16,1.5,20
1894,Learn to Trade the Stock Market without Blowing Your Profits,Business Finance,34,16,1.0,60
1895,Mastering Candlestick Charting : High Probability Trading,Business Finance,35,16,2.0,50
1896,Pin Bars: The Most Powerful Forex Trading Signal,Business Finance,19,16,1.0,200
1897,Corporate Finance 101: Financial Statement Analysis & Ratios,Business Finance,43,16,8.0,50
1898,Beginners Guide To Ichimoku Trading,Business Finance,17,16,1.0,20
1899,Bookkeeping to Command Senior Bookkeeping Wages,Business Finance,58,16,4.5,55
1900,Stock Technical Analysis with Excel,Business Finance,41,16,7.0,50
1901,Trading News Using Binary Options,Business Finance,22,16,1.5,145
1902,Learn Global Macro Trading & Investing for Retail Investor,Business Finance,27,16,1.5,75
1903,Curso Completo de Opciones Binarias: Estrategias 90% Acierto,Business Finance,26,16,1.5,145
1904,Bookkeeping Made Simple,Business Finance,22,16,2.5,40
1905,Forex Harmonic Trading- With Multiple Forex Chart Examples,Business Finance,25,16,2.5,135
1906,Master The Psychology of Forex & Binary Options Trading,Business Finance,7,16,1.0,20
1907,Einnahmen aus Udemy-Kursen als Dozent korrekt versteuern,Business Finance,11,16,1.0,30
1908,Aprende a Ganar Dinero en la Bolsa,Business Finance,42,16,4.0,30
1909,Learn to Trade Forex Naked Price Action Wammie Trade,Business Finance,13,16,1.0,40
1910,Kindle eBook Cover Design and Book Illustration Guide,Graphic Design,20,16,1.0,120
1911,Digital Illustration: Make A Custom Character Illustration,Graphic Design,14,16,1.5,30
1912,Easy Illustration and 2D Animation,Graphic Design,7,16,0.5666666666666667,65
1913,Become a Professional Logo Designer,Graphic Design,82,16,8.0,150
1914,"Sketching: How to Draw People, Hands, Eyes, Buildings & Cars",Graphic Design,31,16,2.0,20
1915,Play Piano To-day! - Beginner Piano Lessons For Busy People!,Musical Instruments,91,16,4.0,100
1916,Piano - Circle of 5ths to Play A Song in 12 Keys in 12 Days,Musical Instruments,115,16,2.5,95
1917,Modern Country Guitar: Technique Booster,Musical Instruments,42,16,2.5,30
1918,Play the Jews Harp - instant skills for non musicians.,Musical Instruments,35,16,2.5,25
1919,Byte-Sized-Chunks: Cascading Style Sheets (CSS) with HTML,Web Development,28,16,4.0,20
1920,Practical Guide to Web Development,Web Development,38,16,2.0,20
1921,Drupal Tutorial : Drupal 8 Beginner to Expert in 8 PROJECTS,Web Development,73,16,7.0,200
1922,WordPress : An Overview,Web Development,15,16,0.6,45
1923,Introduction to HTML5 Canvas basics of drawing,Web Development,17,16,1.0,200
1924,Ruby on Rails Tutorial: Learn 6 Ruby on Rails SEO Techniques,Web Development,21,16,2.0,200
1925,"Web Application Development using Redis, Express, and Socket",Web Development,66,16,6.0,200
1926,A-Frame WebVR Programming Tutorial Series (Virtual Reality),Web Development,22,16,1.5,40
1927,Redux in Angular (2 and 4+),Web Development,13,16,1.5,70
1928,HTML5 and CSS3 : Landing Pages for Entrepreneurs 2016,Web Development,45,16,4.0,195
1929,AngularJs :basics for beginners,Web Development,14,16,1.0,45
1930,"Complete Web Development with HTML, CSS and Javascript",Web Development,10,16,2.0,0
1931,Django For Beginners,Web Development,51,16,4.0,175
1932,Learn to make a colorful one page website,Web Development,16,16,0.5666666666666667,200
1933,Web Building Starter Pack. Html Css and JQuery Animations,Web Development,42,16,7.5,30
1934,How To Create A WordPress Website Without Paying A Developer,Web Development,17,16,1.0,20
1935,Optimizing Wordpress for More Speed and Revenue,Web Development,7,16,0.5833333333333334,0
1936,Web Application Development - Learn by Building 3 Web Apps,Web Development,29,16,1.5,30
1937,Learn Spring Security 4 Intermediate - Hands On,Web Development,20,16,2.0,95
1938,How to manage your own VPS and create websites,Web Development,30,16,1.5,120
1939,Emini ES Futures - Advanced Non Directional Options Trading,Business Finance,14,15,1.5,200
1940,High performance Stock Trading using key Options techniques,Business Finance,6,15,1.5,40
1941,Trading for everyone - The Independent Investor Course I,Business Finance,36,15,4.0,120
1942,Option Trading: How to Adjust Delta-Neutral Strangles!,Business Finance,26,15,1.5,145
1943,Crowdfunding to Win,Business Finance,15,15,1.5,40
1944,Direction-Independ Trading - Elite Forex Traders  Strategy,Business Finance,28,15,2.5,120
1945,Ultimate Retirement: Build Your Own Dynamic Retirement Plan,Business Finance,37,15,6.0,50
1946,Advanced Financial Management for CA / CS / CFA /CPA Exams,Business Finance,194,15,24.5,150
1947,Introduction to Accounting - Analyzing Financial Statements,Business Finance,12,15,1.0,60
1948,Stocks For Beginners - A Guide To Investing,Business Finance,14,15,1.0,20
1949,Trading Intradiario basado en Precio y Volumen,Business Finance,19,15,1.5,40
1950,Accounting 101: Guide to Business Accounting,Business Finance,29,15,14.5,50
1951,An Introduction to Management of Portfolios (MoP),Business Finance,6,15,1.5,20
1952,Stock Market for Beginners. Learn to trade,Business Finance,42,15,3.5,35
1953,Triple P Trading Course,Business Finance,16,15,3.0,20
1954,Stock Trading Essentials for Day Traders,Business Finance,9,15,1.0,100
1955,The Ultimate Fibonacci Trading Plan for Forex and Stocks,Business Finance,15,15,1.0,200
1956,Learn Adobe Illustrator: Semi-Automatic Mandalas Drawing,Graphic Design,15,15,1.0,200
1957,Make tech circles in Photoshop in 30 minutes!,Graphic Design,8,15,0.5666666666666667,50
1958,Make tech circles in Adobe Illustrator in 30 minutes,Graphic Design,5,15,0.5333333333333333,200
1959,Learn Adobe Photoshop in 1 Hour,Graphic Design,10,15,1.0,50
1960,Photoshop para principiantes: ¡De cero a experto!,Graphic Design,62,15,7.5,120
1961,ABC do Adobe Illustrator,Graphic Design,56,15,5.5,35
1962,Learn Digital Drawing in Photoshop,Graphic Design,13,15,2.0,20
1963,Mastering Retouching and Restoration (15 projects Included),Graphic Design,22,15,2.5,100
1964,Getting Started With Digital Painting Using Krita,Graphic Design,11,15,0.6,20
1965,Sketch 3 - New Guide To iOS 8 Mobile App Design (2015),Graphic Design,66,15,5.5,20
1966,Typography From A to Z,Graphic Design,76,15,6.0,100
1967,Adobe Illustrator CS6 باللغة العربية,Graphic Design,74,15,8.0,35
1968,"Learn To Play The Piano Using Pop, R&B and Gospel Chords",Musical Instruments,14,15,0.6833333333333333,50
1969,How To Play The Cajon: For Beginners,Musical Instruments,25,15,1.5,30
1970,CAGED System for Guitar (Guitar Lessons from Lutz Academy),Musical Instruments,7,15,1.5,50
1971,Piano With Willie Building Technique with Scales Vol. 1,Musical Instruments,12,15,1.5,40
1972,Instant Harmonica - play Leonard Cohen's Hallelujah now!,Musical Instruments,14,15,1.5,40
1973,Guitar - Learn 10 Legendary Chord Progressions for Guitar,Musical Instruments,28,15,1.5,55
1974,Just chords Piano: Learn to Play Piano Quickly - No Music,Musical Instruments,53,15,5.0,85
1975,Master Flute Playing: Intermediate Instruction Made Simple!,Musical Instruments,100,15,6.0,50
1976,Electric Bass for Busy Beginners Course 1,Musical Instruments,13,15,1.5,50
1977,Create eye-catching WordPress website from scratch,Web Development,19,15,4.5,30
1978,HTML Tutorials : HTML Code for Website Creating,Web Development,27,15,3.0,20
1979,Pimcore Developer: Implement a Blog from a Bootstrap Theme,Web Development,39,15,4.5,95
1980,Website Secrets: Get a Gorgeous Website on the Cheap,Web Development,32,15,2.0,50
1981,Step by Step Build Your Template by Bootstrap 4 from scratch,Web Development,24,15,3.0,80
1982,Learn Drupal 8 - With a Live Project,Web Development,59,15,3.5,55
1983,CSS3 for beginners,Web Development,25,15,1.5,195
1984,How to Build Your Own Website with WordPress: A Step-by-Step Guide ,Web Development,56,15,6.0,95
1985,The Complete HMTL5 Course - Go From Beginner To Advanced!,Web Development,36,15,2.0,95
1986,Learn HTML in 59 Minutes - Your intro to front-end dev,Web Development,14,15,1.0,35
1987,HTML and CSS Foundations,Web Development,29,15,1.0,0
1988,Learn to Create Advance Responsive Websites With Bootstrap,Web Development,30,15,2.0,20
1989,Master the Art of Web Design with HTML & CSS,Web Development,59,15,3.0,145
1990,Create full featured Landing Page in Ruby on Rails in 3 hour,Web Development,23,15,3.0,30
1991,HTML5 and CSS for Beginner To Expert,Web Development,48,15,4.5,20
1992,The Ultimate jQuery Course,Web Development,54,15,2.5,20
1993,Self Advertise Using PowerPoint Twitter and Facebook on ios,Web Development,6,15,0.6,20
1994,Learn BuddyPress: Build A Social Network with WordPress,Web Development,23,15,1.0,20
1995,The Only Investment Strategy You Need For Your Retirement,Business Finance,15,14,1.0,200
1996,Stock Market Leverage: How to Start Trading Options Wisely,Business Finance,13,14,1.5,95
1997,Complete Trading Plan Course for Stocks & Forex (10 Hours),Business Finance,61,14,9.5,200
1998,Mastering Technical Analysis : Maximizing Trading Profits,Business Finance,62,14,5.0,60
1999,* An Integrated Approach to the Fundamentals of Accounting,Business Finance,123,14,5.5,200
2000,Forex: Economic News Trading,Business Finance,11,14,0.6833333333333333,25
2001,How to invest in Gold,Business Finance,39,14,2.5,50
2002,TRADING TRUTHS,Business Finance,27,14,2.0,50
2003,Forex Trading vs Option Trading,Business Finance,29,14,2.5,95
2004,Forex Trading,Business Finance,25,14,4.5,95
2005,Aprenda Cálculo Financeiro de Forma Simples,Business Finance,21,14,2.0,20
2006,Accounting Department's Tips & Tricks - Beginner to Advanced,Business Finance,61,14,6.0,95
2007,Stock Market: The Zero Risk Way of Investing,Business Finance,8,14,0.6333333333333333,25
2008,Corporate Finance 101: Equity Valuation,Business Finance,50,14,6.0,50
2009,"Investing Internationally into Real Estate, Stocks and Bonds",Business Finance,37,14,2.0,200
2010,Financial Ratios Using Excel,Business Finance,29,14,1.0,100
2011,"Economics:   Competition, Elasticity, a little Game Theory",Business Finance,42,14,6.0,50
2012,Learn to Reliably Invest In The Stock Market,Business Finance,19,14,0.6166666666666667,50
2013,Cost Accounting and Financial Management - A Complete Study,Business Finance,444,14,45.0,150
2014,Learn To Invest In 7 Steps,Business Finance,21,14,3.0,50
2015,MQL4 Bootcamp Tutorial- Trading Robot Coding in Metatrader4,Business Finance,25,14,1.0,20
2016,Forex - Calculate Lot Size Like Pro,Business Finance,11,14,0.6,20
2017,An Intro into Trading the Financial Markets,Business Finance,17,14,1.5,100
2018,Trade for a Living,Business Finance,59,14,8.0,20
2019,Bonds For Beginners - A Guide To The Bond Markets,Business Finance,24,14,0.5666666666666667,20
2020,Getting Started With Photoshop CC,Graphic Design,45,14,4.5,75
2021,Sketch 3: Design a mobile application from scratch,Graphic Design,31,14,2.5,45
2022,Quick and Quirky Caricatures - Learn in an Hour!,Graphic Design,9,14,1.5,20
2023,OpenCV Computer Vision Application Programming ,Graphic Design,30,14,2.5,85
2024,Learn To Draw - The COMIC BOOK STYLE,Graphic Design,19,14,2.0,55
2025,LaTeX A-Z: from beginner to advance in less than 3 hour,Graphic Design,30,14,3.0,95
2026,FullPage: The Complete Guide to Flat Websites,Graphic Design,13,14,0.6333333333333333,20
2027,Mike G's Beginner Drum Course: Part 1,Musical Instruments,20,14,3.0,35
2028,150 Rock Guitar Licks You MUST Know,Musical Instruments,21,14,4.5,45
2029,"How to play Djembe, Drums & Rhythm. Level 2",Musical Instruments,36,14,2.0,40
2030,Play Piano 1 Master Class Intro:  Standards 2-5 Power Chords,Musical Instruments,42,14,1.0,50
2031,Learn the Violin - Scales and Fundamentals,Musical Instruments,39,14,3.0,80
2032,Bluegrass Guitar Essentials: Webisodes 1 & 2,Musical Instruments,9,14,1.0,0
2033,JavaScript Tutorial: Learn JavaScript Code for Beginners,Web Development,22,14,1.5,20
2034,What’s New in Bootstrap 4,Web Development,20,14,0.6166666666666667,20
2035,Learn ASP.Net Web API 2 for Absolute Beginner,Web Development,29,14,3.5,30
2036,Wordpress Theme Development for Beginners,Web Development,47,14,8.0,20
2037,Bootstrap For Beginners: A  Basic Introduction,Web Development,9,14,0.6666666666666666,55
2038,JavaScript Basics For Web Developers,Web Development,17,14,1.0,20
2039,Adobe Experience Manager CMS Basics,Web Development,33,14,1.0,35
2040,Create Your Own Successful Online School To Sell Courses,Web Development,39,14,2.0,95
2041,HTML5 and CSS3 -Start building beautiful websites,Web Development,22,14,2.5,150
2042,WordPress for Beginners 2017 + Google AdSense Implementation,Web Development,64,14,6.5,195
2043,Learn Laravel with Database Migration & Seeding & Faker,Web Development,7,14,1.0,20
2044,HTML & CSS - Learn to build sleek websites ,Web Development,44,14,3.5,55
2045,Build Powerful Websites & Blogs using WordPress - No Coding,Web Development,26,14,3.0,20
2046,Building Responsive Websites with Bootstrap 3 Framework,Web Development,27,14,3.0,75
2047,The Fastest Way to Create a Website Using Godaddy,Web Development,12,14,0.5,30
2048,Learn jQuery from Scratch - Master of JavaScript library,Web Development,21,14,2.0,100
2049,Accounting for Beginners : Learn Basics in under 1 Hour,Business Finance,20,13,1.5,50
2050,EFT for Stock Options Trading Success & Making Better Trades,Business Finance,31,13,1.5,95
2051,How to be a Profitable Forex Trader,Business Finance,7,13,0.6833333333333333,20
2052,Volatility Trading Analysis with R,Business Finance,45,13,6.0,50
2053,Bitcoin - A Comprehensive Guide,Business Finance,35,13,2.5,20
2054,Forex Trading Profitably,Business Finance,15,13,0.6666666666666666,20
2055,Forex Trading :RSI Indicator-A Secret Weapon,Business Finance,14,13,1.5,95
2056,Fundamental Financial Math,Business Finance,15,13,2.5,50
2057,Tradeonomics - Four Steps to Mastering Economic Indicators,Business Finance,41,13,4.0,20
2058,資産運用の基礎を学ぶファイナンス入門,Business Finance,52,13,4.0,20
2059,Learn How to Start Small and Make It Big In Small-Cap Stocks,Business Finance,29,13,2.0,50
2060,IPO Fundamentals,Business Finance,6,13,1.0,20
2061,Stocks: Quick Method to get started Investing,Business Finance,7,13,1.0,0
2062,Investment Portfolio Analysis with Python,Business Finance,37,13,7.0,50
2063,Credit Repair from a Financial Institution,Business Finance,9,13,2.5,20
2064,Finanzas Personales para Vivir Libre de Deudas,Business Finance,77,13,6.0,75
2065,Stock Fundamental Analysis with Excel,Business Finance,50,13,10.0,50
2066,Forex trading Basic to advance Professional Level course,Business Finance,28,13,2.5,20
2067,Learn to Trade Forex Big U-Turn Trade,Business Finance,12,13,1.0,50
2068,Contabilidad Financiera: Conoce el Lenguaje de los Negocios.,Business Finance,21,13,2.5,20
2069,Learn Stock Options: Options Made Simple 101,Business Finance,49,13,5.0,35
2070,Advance Learning Tools Corel Draw Graphics Design,Graphic Design,70,13,14.0,40
2071,캔바(Canva)로 SNS 콘텐츠 만들기,Graphic Design,19,13,2.0,30
2072,BUSINESS CARD DESIGN IN POWERPOINT,Graphic Design,16,13,1.0,95
2073,Flat Design - Create Beautiful Flat Graphics In Photoshop,Graphic Design,23,13,2.0,20
2074,Affinity Designer - making seamless patterns,Graphic Design,11,13,1.0,20
2075,Typography: Learn the Foundation and Designs,Graphic Design,33,13,2.5,135
2076,Photoshop JumpStart,Graphic Design,13,13,2.0,20
2077,Corel Draw X7: Mão na Massa,Graphic Design,40,13,4.0,25
2078,Intro to Adobe Illustrator,Graphic Design,55,13,6.0,20
2079,Guitar for Beginners - Learn the Basics,Musical Instruments,19,13,0.5166666666666666,20
2080,Guitar Fretboard Secrets,Musical Instruments,35,13,2.0,55
2081,"Discover the fun of Spoon playing, a beginners course",Musical Instruments,25,13,1.0,65
2082,CAGED Pentatonic System for Guitar - Level 2,Musical Instruments,26,13,1.5,45
2083,Learn to play the Bouzouki - Greek Bouzouki Lessons,Musical Instruments,49,13,1.0,50
2084,Guitar Looper Basic Training,Musical Instruments,15,13,1.5,45
2085,Angular 4 Development Decoded,Web Development,8,13,1.0,20
2086,Wordpress - Create an Outstanding Website in 2 hours,Web Development,48,13,2.5,30
2087,Install a Wordpress Theme the Correct Way & Charge Others,Web Development,18,13,1.0,20
2088,The All-In-One Web Development Course,Web Development,113,13,18.5,85
2089,WordPress: Create an Amazing Website With Ease,Web Development,24,13,2.5,200
2090,WordPress 2016 for Beginners : Build awesome websites!,Web Development,43,13,4.0,20
2091,Set up a localhost Web Server for Faster Website Development,Web Development,31,13,1.5,30
2092,Develop a Professional OnePage WordPress site With No Coding,Web Development,13,13,1.5,20
2093,Css For Beginners,Web Development,28,13,2.5,85
2094,Ultimate guide to Social Media Web development integration ,Web Development,36,13,2.5,200
2095,Build a Chatbot integrated Website using Bootstrap 4,Web Development,28,13,3.0,50
2096,Creating Interactive HTML5 Video,Web Development,23,13,2.0,25
2097,Convert HTML Websites into PHP: Learn by Doing in 40 Minutes,Web Development,15,13,0.6,50
2098,HTML and CSS: A Guide to Web Design,Web Development,74,13,14.0,25
2099,The Complete Short Course on Ethereum,Business Finance,28,12,1.5,200
2100,How I Learned Stock Trading (and How You Can Too),Business Finance,53,12,2.0,200
2101,Basics of Economics (College Level),Business Finance,20,12,1.5,25
2102,Save on Your Taxes,Business Finance,23,12,1.5,20
2103,"How to remove 'Risk from Penny Stocks - Options Trading""",Business Finance,22,12,1.0,200
2104,Accounting Is Easy (for Beginners),Business Finance,90,12,9.0,20
2105,A Value Investing Approach to the Stock Market,Business Finance,15,12,1.5,20
2106,Learn how to INVEST for huge profits or make it big trading!,Business Finance,37,12,5.5,50
2107,Succeed in Lotto Even if You Don't Know Where to Start!,Business Finance,18,12,1.5,20
2108,Accounting 101: Learn Business Finance Forecasting in 60mins,Business Finance,12,12,1.5,95
2109,The Complete Financial Statement Analysis Course,Business Finance,37,12,3.0,150
2110,"Multiply your returns using 'Value Investing"",https://www.udemy.com/multiply-your-returns-using-value-investing/,true,20,1942,19,63,All Levels,4.5 hours,2015-07-23T00:08:33Z
874284,Weekly Forex Analysis by Baraq FX""",Business Finance,14,12,1.5,0
2111,Master Finance in Three Hours,Business Finance,29,12,3.0,20
2112,The Binary Institute - Introductory Course in Binary Options,Business Finance,6,12,1.0,0
2113,How to Start Investing: Made Simple and Easy,Business Finance,12,12,1.0,200
2114,Investing in stocks: Avoid stock market loss,Business Finance,13,12,1.0,125
2115,Trade RSI Breakout Strategy: Great Risk/Reward Ratio (Forex),Business Finance,19,12,2.0,200
2116,No Bull Investing: Investing 101 For Financial Freedom,Business Finance,25,12,6.5,100
2117,Capital Structuring Techiques for CA / CFA / CPA Exams,Business Finance,50,12,7.0,125
2118,The Complete Guide to Forex Trading,Business Finance,33,12,5.0,20
2119,Startup Business: How To Raise Seed Capital,Business Finance,34,12,3.0,95
2120,Bitcoin - The Complete Guide,Business Finance,24,12,5.5,20
2121,The Art Of Financial Valuation With Certificate,Business Finance,12,12,2.0,20
2122,Financial Modeling for Professionals in 1 Day!,Business Finance,29,12,4.5,200
2123,Trading For Busy People,Business Finance,26,12,3.0,50
2124,CFP - Introduction to Financial Planning,Business Finance,38,12,12.0,30
2125,Intermediate Accounting 1: Easy. Fast. Simple!,Business Finance,35,12,2.5,200
2126,Financial Statements: Learn Accounting. Unlock the Numbers.,Business Finance,35,12,3.0,40
2127,Trader sur le Forex avec Ichimoku,Business Finance,18,12,2.5,90
2128,Learn Blender 3D  - The introduction course,Graphic Design,15,12,1.5,100
2129,LOGO DESIGN IN POWERPOINT,Graphic Design,28,12,1.0,95
2130,Adobe Illustrator CC,Graphic Design,46,12,9.5,20
2131,なぞるだけですぐできる! 簡単手描きイラスト講座,Graphic Design,48,12,3.0,30
2132,"Become a Graphic Designer, and earn a living from it",Graphic Design,37,12,3.0,35
2133,Clipping Masks & Shaped images in Adobe Photoshop CC,Graphic Design,14,12,0.7333333333333333,90
2134,Digital Asset Designer: Creating and Selling Mockups,Graphic Design,28,12,3.0,50
2135,Adobe Illustrator CC - From scratch ,Graphic Design,24,12,5.5,45
2136,Blues Guitar Lessons - From Texas To Carolina,Musical Instruments,9,12,2.5,20
2137,Rock Drumset Grooves: Level 1,Musical Instruments,38,12,2.0,20
2138,Guitar: The Next Level,Musical Instruments,10,12,1.0,55
2139,FingerstyleGuitar by Jacques Stotzem - Basic Level,Musical Instruments,16,12,1.5,30
2140,Your Second Course on Piano: Two Handed Playing,Musical Instruments,22,12,5.0,70
2141,How To Make Money With A Cover Band,Musical Instruments,25,12,3.5,50
2142,Aprendiendo piano: Lectura de piezas clásicas Vol.I,Musical Instruments,30,12,1.5,50
2143,Guitarra Desde Cero - PARTE 1,Musical Instruments,123,12,7.0,35
2144,Beginning Flute Lessons,Musical Instruments,17,12,2.5,20
2145,Fingerpicking Blues Guitar Lessons - Bottleneck Guitar,Musical Instruments,6,12,1.5,20
2146,Sintetizadores e Síntese Subtrativa,Musical Instruments,83,12,5.0,85
2147,GUITAR #1: Beginner Basics and Beyond,Musical Instruments,64,12,3.0,20
2148,Learn HTML and CSS to make a Website,Web Development,71,12,6.0,20
2149,Website Builder Software Previews,Web Development,20,12,1.0,25
2150,Learn PHP from scratch!!,Web Development,17,12,1.5,25
2151,Build a Business or Personal Website Using Wordpress,Web Development,61,12,4.5,200
2152,PHP Laravel 5:Creating a CRUD application,Web Development,7,12,0.55,45
2153,Learn Ruby Programming The Easy Way - Lite,Web Development,7,12,0.5666666666666667,20
2154,Learn To Build A Google Map App Using Angular 2,Web Development,7,12,1.0,30
2155,Become a Certified Web Developer - Beginner to Expert,Web Development,85,12,8.0,200
2156,Up and Running with Phalcon,Web Development,12,12,1.5,20
2157,PHP For WordPress Development,Web Development,16,12,1.0,35
2158,Learn JavaScript Dynamic Interactive Projects for Beginners,Web Development,36,12,3.0,100
2159,Mastering Web and Mobile Debugging Using Chrome Dev Tools,Web Development,21,12,2.0,195
2160,XML :basics for beginners,Web Development,11,12,0.65,40
2161,Learn HTML5 Canvas for beginners,Web Development,49,12,3.5,100
2162,Beginner to Pro - Financial Analysis in Excel 2017,Business Finance,36,11,3.0,95
2163,Mastering High Probability Iron Condor Options Trading,Business Finance,22,11,2.0,200
2164,Three Steps Trading - Live Trading - Real Account,Business Finance,46,11,5.0,190
2165,Options Trading - Calendar Spread Course for Every Trader,Business Finance,17,11,1.5,200
2166,Stock market Investing Encyclopedia: How to invest in stocks,Business Finance,39,11,3.0,200
2167,Get a Credit Repair Publication On Amazon and Live LIFE..,Business Finance,25,11,3.0,20
2168,Learn How to Play CashFlow Game,Business Finance,26,11,1.0,35
2169,Curso Avanzado de Trading,Business Finance,100,11,20.5,125
2170,Análise de Concessão de Crédito,Business Finance,20,11,10.5,20
2171,A Complete Guide to Becoming a Trader on the Forex Market,Business Finance,15,11,1.0,25
2172,Situational Trading: Proven Option Strategy for any Scenario,Business Finance,16,11,1.5,200
2173,Cost Accounting Crash Course,Business Finance,17,11,2.5,20
2174,High-Frequency Trading & Dark Pools,Business Finance,22,11,2.0,40
2175,"Investing In Stocks For Big Gains, Fundamental Investing",Business Finance,21,11,2.0,200
2176,Forex Trading Profit 183%p.a : Trend is Our Friend-ALGOTREND,Business Finance,12,11,0.6,120
2177,Winning Options Trading System,Business Finance,24,11,7.5,105
2178,Smart Trading Techniques for Safe & Consistent Weekly Result,Business Finance,24,11,2.5,100
2179,Trading Forex - Trader avec les figures harmoniques,Business Finance,23,11,2.0,90
2180,Cashflow Management for Small Businesses: A How To Guide,Business Finance,5,11,0.6166666666666667,25
2181,Start Trading Stocks Using Technical Analysis! Part 2,Business Finance,25,11,2.0,95
2182,High-Frequency Trading #2: Market Structure & Instruments,Business Finance,12,11,0.6833333333333333,50
2183,Cost Accounting Basics (Professional Course Level),Business Finance,23,11,1.0,20
2184,Trade the News in Forex: EA Robot Included,Business Finance,11,11,0.5666666666666667,200
2185,ProTrader -  Advanced Technical Analysis,Business Finance,34,11,2.0,125
2186,Binary Options Masterclass,Business Finance,16,11,2.0,200
2187,株式投資に向く性格に変えるための心理学を学ぶ,Business Finance,28,11,1.5,20
2188,Profit During Crashing Markets: A Step-by-Step Guide,Business Finance,18,11,1.0,195
2189,Gana en la Bolsa con Análisis Técnico,Business Finance,35,11,8.5,25
2190,Investiere in Tax Liens-Hohe Zinsen gesetzl. festgeschrieben,Business Finance,7,11,1.5,20
2191,Trading Robot Forex Programs in Your Sleep in Live Examples!,Business Finance,18,11,1.5,200
2192,Triangulated Bird: Origami Styled Bird in Adobe Illustrator,Graphic Design,9,11,0.5,195
2193,Expert Guide : Mastering Types feature in illustrator !,Graphic Design,27,11,2.5,190
2194,Cartoon Game Logo Design using Photoshop,Graphic Design,15,11,2.5,20
2195,Turn Your Photos Into Professional And Modern Artworks,Graphic Design,12,11,1.5,20
